{"dropoffs":{"fhvhv":[115578,127132,141384,142900,155976,139638,130475,128865,135422,152854,149746,177218,21,34,33,53,73,73,60,71,48,56,40,26,40752,40395,44469,41195,43080,40826,40338,40600,39322,41102,41590,45154,55558,55476,58233,52794,53024,51977,48517,50076,48907,52197,53055,54574,5249,4887,5606,5198,5491,5478,5230,4897,5043,5216,5392,6101,11076,10717,12114,11183,12033,11542,11311,11403,10984,11514,11649,12275,193647,179014,207501,186224,193677,191602,183447,176848,174637,183849,183853,199575,376,410,572,849,873,1762,1389,1122,962,935,601,386,16834,15992,17616,16570,18727,17473,16188,15669,16504,17945,17212,19255,51809,50173,57650,52916,57723,55805,55008,54658,53243,53252,53550,60527,21611,20597,22709,21233,21960,21250,20147,19715,19669,20590,21351,23887,3070,2730,3671,3506,3930,4486,5415,4685,3149,3692,3459,3915,82952,78674,84780,83220,84856,83730,82403,73991,75489,84353,78053,79320,106888,102258,114760,108207,113737,111139,102764,100903,101162,110897,108786,122610,12548,12289,13762,13242,14156,14201,13918,13665,13546,14481,14002,15446,36527,34863,38736,36408,38780,37444,35814,35713,36393,39131,37721,42145,172594,169330,184588,163558,172677,175451,162326,161923,160718,161264,167785,174928,84209,84967,93169,85650,86042,83981,82481,83190,78977,83726,87898,95361,13773,13062,14238,13813,14571,14568,14067,13681,13700,14998,14019,15251,53855,55422,61420,58752,59822,55468,53668,54509,54792,60073,57936,60348,49900,47852,52944,47524,50555,47795,42653,42512,45956,47038,49263,56176,65163,61360,68772,62445,66076,63409,59133,59152,60309,61031,65153,74747,34381,33831,36311,32963,34869,31010,30496,30006,34111,34342,34322,38810,27197,26119,27671,26550,28055,25012,23337,24192,24343,25696,26673,26643,102782,102673,112929,102650,107130,104991,97993,102217,100336,108210,105319,107004,118699,109675,120157,98498,105100,99310,78268,75931,103317,82981,103351,120861,908,876,1118,1102,1919,4840,5509,4685,2068,1211,1279,1249,45931,44065,48905,45704,47603,45375,42931,42967,43484,45196,46036,50674,39272,37086,41038,38124,40071,39351,39363,38053,36745,38773,39433,44795,813,808,1062,949,1204,1512,1510,1497,1292,1236,1233,1313,6047,5926,8707,10634,9780,11510,10510,9615,9485,13452,10394,9699,44346,43421,48871,43782,44264,43675,41607,44076,42100,42863,43763,47907,88391,86986,95633,92446,98366,96360,88686,86573,91637,95988,90453,90202,17426,18611,23125,21370,23434,25226,23723,19665,23746,27915,22494,21295,105635,110505,129106,110450,114048,112451,106910,110532,103062,104435,109832,117385,150358,146680,165141,150710,160775,166236,148439,150685,150197,153315,153756,161545,213605,215908,236459,214666,224630,230759,210754,213135,211279,218573,218956,221233,17537,16657,18472,17059,18482,18252,18803,17815,18087,18056,18499,20325,133765,131167,148161,136867,142899,141719,139104,140202,132327,132607,138929,149017,44526,45702,49130,45344,47114,45954,39573,40906,43670,50599,47352,47981,117120,118409,128365,117424,120775,120821,113837,116403,111515,115626,119726,124860,165307,164372,179731,164190,164990,163583,157179,162474,150915,157207,164340,170851,35587,34110,40678,42461,45944,46809,45376,40053,40645,42959,41851,45345,7496,7176,8198,7796,8366,8586,7844,7890,7612,8515,8596,9736,44392,45514,46896,42230,45691,43327,43701,42590,43329,44055,44364,46404,2776,3145,3946,3847,4929,5922,5314,5018,4182,4150,3795,3768,60265,60564,69346,61352,63429,60885,56960,58588,57082,60461,61948,65465,166143,157754,172140,155111,162728,162467,161043,158588,154157,159089,161525,160460,120462,123080,134640,122238,124729,119159,111972,118868,117384,123895,125370,127075,95312,95036,98908,96469,101251,97336,91787,94753,93298,97405,90805,87372,65380,68337,76246,68648,71537,73813,69534,70682,66658,70026,71825,83106,28635,27689,29539,27085,27889,26810,23580,23760,25072,28723,28212,28690,28541,27795,30429,29449,31335,30091,30377,30435,29279,31371,29913,33453,11491,11090,12028,11395,12015,11640,9890,9998,11452,12016,11670,12086,49037,49341,55651,52299,57470,62439,59453,56655,50600,51624,51664,55263,51093,48497,53528,49617,52464,54046,50568,50646,48764,50260,52570,60371,3686,3445,3796,3483,3897,4096,3853,3799,3705,4020,4082,4551,5886,5688,6447,6023,6532,6626,6379,6248,5821,6242,6353,6821,2070,1976,2316,2413,2614,3242,3103,3272,2805,2283,2355,2355,39578,39928,44737,40046,41153,40284,38911,39532,37078,37900,40004,43009,268459,268818,303562,266196,280912,282639,263443,267708,255458,261977,272302,284234,71270,72193,79461,69583,72827,72233,65697,67322,68843,67503,71647,75627,56838,56812,65060,59361,63028,61730,59842,60062,57173,58683,61241,66635,11159,10582,11650,11068,11813,11966,11547,11383,11507,12487,11802,12654,78571,81553,92443,83881,89792,88006,84875,87560,87170,91559,86117,85711,60840,62427,68206,64784,69072,69242,66224,64298,63821,68912,64957,67407,34760,32449,36564,34634,36575,35712,32520,32940,33371,35133,35051,46065,214569,209287,225593,213486,223084,219309,215456,208096,213230,219534,212474,219706,97008,97737,109427,98510,100007,97163,93110,95141,91167,95651,98338,103118,34350,33248,38748,35758,40191,39675,38143,37422,36317,38884,39342,45128,80899,79752,91493,83687,87995,88221,85909,87490,83501,81353,84368,90672,93610,91404,105369,93686,98926,99320,95859,96504,91147,90270,94863,101435,18806,17815,19725,18079,19183,18517,18967,18846,18387,18943,19195,21587,133101,133090,148276,132813,136897,133638,133385,135141,126862,134095,134773,141121,138334,133612,141446,131570,134160,126627,128280,129239,123322,129629,128453,134141,205069,209318,237758,213431,220150,214110,208657,212112,199120,205928,210473,230127,53845,54758,63610,57724,60072,59109,56097,56934,53537,54819,56444,60030,78935,79811,89883,82143,82465,79622,78336,82207,77183,80143,81843,87706,232984,230586,245888,216299,214424,211907,196556,200345,206373,213541,215715,211364,137259,143885,159931,147526,165172,175287,154513,154163,158620,157531,151485,147953,47853,47869,53983,49352,51648,50333,48075,48902,45914,48047,48839,53516,131845,124914,136710,127063,133043,131267,128232,130339,126937,132821,137565,161982,44159,40374,44454,41437,42792,43071,42109,42223,42458,44209,45702,51002,8102,7750,8772,7878,8847,8697,7880,7869,8438,9079,8892,9599,59012,59662,68348,60396,63102,63924,60117,63750,58404,58953,63799,66506,32563,32949,37919,33520,34635,33512,33883,35555,33028,33272,34723,37134,107644,108656,114906,111758,120927,121677,117957,112531,118527,122878,112221,115280,45600,46195,52599,51229,55953,54090,51865,47327,50895,53796,50704,49731,161863,154743,181231,155378,163830,160452,148531,151840,156150,162899,164992,175236,123457,119162,125738,115508,116473,111448,103509,102327,114472,116475,113769,115732,88064,84997,96800,87443,94183,92591,89145,90176,86537,85474,90917,99221,96506,94690,103211,94384,102249,97807,98667,100998,96378,102469,102462,112540,7675,7712,11961,18794,29793,39196,26085,52521,45358,20082,12344,10038,37140,38671,43229,38333,38316,37826,36460,36489,34917,36207,38199,41047,131840,127737,140441,129319,141743,138580,130193,135994,139894,143344,134260,147034,2223,2459,3119,3334,3848,4788,4255,3976,3555,3271,2929,2363,117434,118736,135472,123822,128315,128593,120047,124299,124725,125685,119808,122116,16736,16010,18115,17111,18726,18821,18549,18557,17010,17534,17184,19170,518,527,575,491,491,535,527,516,494,569,523,574,94622,91010,97843,89129,94993,92770,95718,92279,89118,92716,92226,94557,12213,11996,12822,11984,12539,12088,12412,12532,12556,13359,12845,14092,44336,42846,48345,44161,46826,47163,46457,46046,43884,45634,46927,52295,0,0,0,0,0,0,0,0,0,0,0,0,0,0,null,0,0,0,0,0,null,0,0,0,14,null,null,null,null,null,null,null,null,null,null,null,35904,36008,40054,36739,38357,37584,33988,35077,35529,37186,36502,36994,148512,143198,151506,140010,139281,132079,122774,121835,131594,138552,137573,142914,27078,26360,29737,26401,28256,27162,25134,24576,25826,26755,27436,30385,11424,11063,12913,11467,12616,12854,12311,12235,11467,12351,12681,14017,60,53,60,63,86,99,103,76,60,69,64,56,724,754,891,933,1003,928,726,706,910,1046,907,799,177272,177922,194018,179249,192289,193450,190723,187052,179528,193597,186114,187201,111560,116534,118241,117002,105983,91537,84608,85743,100370,106701,103543,103783,119230,122432,128000,120268,113250,105085,98176,98086,109690,114030,112680,110525,13755,14209,16142,14583,14942,13846,13733,14089,14148,14864,15299,15739,86307,85797,92156,83907,87138,85505,83200,83072,79940,85162,88600,91485,25670,26457,30681,26525,27507,28325,29491,29798,25967,26160,26579,28644,20206,20032,22177,20120,22384,21832,20776,20469,20499,21080,21047,24234,59860,59969,68012,64940,68056,65539,64355,65454,62705,64813,63613,66467,2503,2749,2981,2864,3415,3239,3239,2864,3034,3107,2897,2700,41703,42403,47496,45483,41906,40570,37475,36665,43750,45407,44574,45388,19751,18928,21966,20420,21513,20972,20083,20269,19757,19979,20634,22960,59820,58860,65913,56113,59307,52624,46539,45756,54330,53733,59628,69284,26784,25531,28545,26839,28986,29429,27934,27586,26619,28028,27937,31674,60627,61242,64430,62368,62259,58320,56462,54927,62827,63085,58623,59848,65039,64800,71773,64656,64937,63226,64011,64852,59158,61569,63236,68532,68079,69019,76005,68734,77702,70318,66699,67773,64279,69667,70142,72633,6451,6255,6495,6530,8109,6629,7004,6843,6477,6994,6570,6549,138865,130875,144811,135111,141533,140185,138538,134420,130569,136917,141921,160743,143020,142688,158717,149506,155660,150217,151934,154144,146465,153184,152214,166011,28863,28521,31616,29819,29950,29094,28634,28154,29255,30154,30099,32022,384727,388107,437825,417545,484961,452526,431776,447743,423641,441991,422721,476949,40291,38886,43053,37087,38209,38975,33801,34549,36597,36789,39266,43158,42630,41648,45353,42292,44715,42969,43035,43602,42035,44268,43927,48303,32543,34665,38624,33312,37607,31006,28470,28649,36153,35640,35864,38081,47634,49519,55067,48476,49451,46827,45192,46664,45430,48347,49615,53073,120171,111979,119345,107184,108930,105073,107118,105159,102900,107015,107860,109922,358214,375776,429145,423362,478309,446765,446366,445785,433563,474814,454581,464881,29394,28096,32180,29565